{
  "cohorts": {
    "pending_lineage": [],
    "published_lineage": [
      "abyss-safe-infra-change",
      "abyss-sanitized-share",
      "abyss-self-diagnostic-spine",
      "aoa-adr-write",
      "aoa-approval-gate-check",
      "aoa-automation-opportunity-scan",
      "aoa-bounded-context-map",
      "aoa-change-protocol",
      "aoa-checkpoint-closeout-bridge",
      "aoa-commit-growth-seam",
      "aoa-contract-test",
      "aoa-core-logic-boundary",
      "aoa-decision",
      "aoa-decision-correct",
      "aoa-decision-create",
      "aoa-decision-find",
      "aoa-dry-run-first",
      "aoa-invariant-coverage-audit",
      "aoa-local-stack-bringup",
      "aoa-memo-writeback",
      "aoa-port-adapter-refactor",
      "aoa-property-invariants",
      "aoa-quest-harvest",
      "aoa-safe-infra-change",
      "aoa-sanitized-share",
      "aoa-session-donor-harvest",
      "aoa-session-progression-lift",
      "aoa-session-route-forks",
      "aoa-session-self-diagnose",
      "aoa-session-self-repair",
      "aoa-source-of-truth-check",
      "aoa-summon",
      "aoa-tdd-slice",
      "atm10-change-protocol",
      "atm10-source-of-truth-check",
      "titan-approval-ledger",
      "titan-approval-loom",
      "titan-appserver-bridge",
      "titan-appserver-plan",
      "titan-closeout",
      "titan-console",
      "titan-event-replay",
      "titan-memory-loom",
      "titan-memory-prune",
      "titan-mutation-gate",
      "titan-recall",
      "titan-receipt",
      "titan-runtime-gate",
      "titan-summon",
      "titan-thread-turn-binding"
    ]
  },
  "lineage_surface_version": 1,
  "skills": [
    {
      "lineage_blockers": [],
      "lineage_state": "published",
      "manifest_canonical_path_ready": true,
      "name": "abyss-safe-infra-change",
      "pending_technique_count": 0,
      "published_technique_count": 2,
      "scope": "project",
      "skill_path": "abyss/abyss-safe-infra-change/SKILL.md",
      "status": "evaluated",
      "tbd_ref_count": 0
    },
    {
      "lineage_blockers": [],
      "lineage_state": "published",
      "manifest_canonical_path_ready": true,
      "name": "abyss-sanitized-share",
      "pending_technique_count": 0,
      "published_technique_count": 2,
      "scope": "project",
      "skill_path": "abyss/abyss-sanitized-share/SKILL.md",
      "status": "evaluated",
      "tbd_ref_count": 0
    },
    {
      "lineage_blockers": [],
      "lineage_state": "published",
      "manifest_canonical_path_ready": true,
      "name": "abyss-self-diagnostic-spine",
      "pending_technique_count": 0,
      "published_technique_count": 2,
      "scope": "project",
      "skill_path": "abyss/abyss-self-diagnostic-spine/SKILL.md",
      "status": "scaffold",
      "tbd_ref_count": 0
    },
    {
      "lineage_blockers": [],
      "lineage_state": "published",
      "manifest_canonical_path_ready": true,
      "name": "aoa-adr-write",
      "pending_technique_count": 0,
      "published_technique_count": 2,
      "scope": "core",
      "skill_path": "engineering/aoa-adr-write/SKILL.md",
      "status": "canonical",
      "tbd_ref_count": 0
    },
    {
      "lineage_blockers": [],
      "lineage_state": "published",
      "manifest_canonical_path_ready": true,
      "name": "aoa-approval-gate-check",
      "pending_technique_count": 0,
      "published_technique_count": 1,
      "scope": "risk",
      "skill_path": "risk/aoa-approval-gate-check/SKILL.md",
      "status": "canonical",
      "tbd_ref_count": 0
    },
    {
      "lineage_blockers": [],
      "lineage_state": "published",
      "manifest_canonical_path_ready": true,
      "name": "aoa-automation-opportunity-scan",
      "pending_technique_count": 0,
      "published_technique_count": 3,
      "scope": "core",
      "skill_path": "session-growth/aoa-automation-opportunity-scan/SKILL.md",
      "status": "evaluated",
      "tbd_ref_count": 0
    },
    {
      "lineage_blockers": [],
      "lineage_state": "published",
      "manifest_canonical_path_ready": true,
      "name": "aoa-bounded-context-map",
      "pending_technique_count": 0,
      "published_technique_count": 2,
      "scope": "core",
      "skill_path": "engineering/aoa-bounded-context-map/SKILL.md",
      "status": "canonical",
      "tbd_ref_count": 0
    },
    {
      "lineage_blockers": [],
      "lineage_state": "published",
      "manifest_canonical_path_ready": true,
      "name": "aoa-change-protocol",
      "pending_technique_count": 0,
      "published_technique_count": 2,
      "scope": "core",
      "skill_path": "engineering/aoa-change-protocol/SKILL.md",
      "status": "canonical",
      "tbd_ref_count": 0
    },
    {
      "lineage_blockers": [],
      "lineage_state": "published",
      "manifest_canonical_path_ready": true,
      "name": "aoa-checkpoint-closeout-bridge",
      "pending_technique_count": 0,
      "published_technique_count": 3,
      "scope": "core",
      "skill_path": "session-growth/aoa-checkpoint-closeout-bridge/SKILL.md",
      "status": "evaluated",
      "tbd_ref_count": 0
    },
    {
      "lineage_blockers": [],
      "lineage_state": "published",
      "manifest_canonical_path_ready": true,
      "name": "aoa-commit-growth-seam",
      "pending_technique_count": 0,
      "published_technique_count": 2,
      "scope": "core",
      "skill_path": "session-growth/aoa-commit-growth-seam/SKILL.md",
      "status": "evaluated",
      "tbd_ref_count": 0
    },
    {
      "lineage_blockers": [],
      "lineage_state": "published",
      "manifest_canonical_path_ready": true,
      "name": "aoa-contract-test",
      "pending_technique_count": 0,
      "published_technique_count": 2,
      "scope": "core",
      "skill_path": "engineering/aoa-contract-test/SKILL.md",
      "status": "canonical",
      "tbd_ref_count": 0
    },
    {
      "lineage_blockers": [],
      "lineage_state": "published",
      "manifest_canonical_path_ready": true,
      "name": "aoa-core-logic-boundary",
      "pending_technique_count": 0,
      "published_technique_count": 2,
      "scope": "core",
      "skill_path": "engineering/aoa-core-logic-boundary/SKILL.md",
      "status": "evaluated",
      "tbd_ref_count": 0
    },
    {
      "lineage_blockers": [],
      "lineage_state": "published",
      "manifest_canonical_path_ready": true,
      "name": "aoa-decision",
      "pending_technique_count": 0,
      "published_technique_count": 2,
      "scope": "core",
      "skill_path": "engineering/aoa-decision/SKILL.md",
      "status": "evaluated",
      "tbd_ref_count": 0
    },
    {
      "lineage_blockers": [],
      "lineage_state": "published",
      "manifest_canonical_path_ready": true,
      "name": "aoa-decision-correct",
      "pending_technique_count": 0,
      "published_technique_count": 3,
      "scope": "core",
      "skill_path": "engineering/aoa-decision-correct/SKILL.md",
      "status": "evaluated",
      "tbd_ref_count": 0
    },
    {
      "lineage_blockers": [],
      "lineage_state": "published",
      "manifest_canonical_path_ready": true,
      "name": "aoa-decision-create",
      "pending_technique_count": 0,
      "published_technique_count": 2,
      "scope": "core",
      "skill_path": "engineering/aoa-decision-create/SKILL.md",
      "status": "evaluated",
      "tbd_ref_count": 0
    },
    {
      "lineage_blockers": [],
      "lineage_state": "published",
      "manifest_canonical_path_ready": true,
      "name": "aoa-decision-find",
      "pending_technique_count": 0,
      "published_technique_count": 1,
      "scope": "core",
      "skill_path": "engineering/aoa-decision-find/SKILL.md",
      "status": "evaluated",
      "tbd_ref_count": 0
    },
    {
      "lineage_blockers": [],
      "lineage_state": "published",
      "manifest_canonical_path_ready": true,
      "name": "aoa-dry-run-first",
      "pending_technique_count": 0,
      "published_technique_count": 2,
      "scope": "risk",
      "skill_path": "risk/aoa-dry-run-first/SKILL.md",
      "status": "canonical",
      "tbd_ref_count": 0
    },
    {
      "lineage_blockers": [],
      "lineage_state": "published",
      "manifest_canonical_path_ready": true,
      "name": "aoa-invariant-coverage-audit",
      "pending_technique_count": 0,
      "published_technique_count": 1,
      "scope": "core",
      "skill_path": "engineering/aoa-invariant-coverage-audit/SKILL.md",
      "status": "canonical",
      "tbd_ref_count": 0
    },
    {
      "lineage_blockers": [],
      "lineage_state": "published",
      "manifest_canonical_path_ready": true,
      "name": "aoa-local-stack-bringup",
      "pending_technique_count": 0,
      "published_technique_count": 4,
      "scope": "risk",
      "skill_path": "risk/aoa-local-stack-bringup/SKILL.md",
      "status": "evaluated",
      "tbd_ref_count": 0
    },
    {
      "lineage_blockers": [],
      "lineage_state": "published",
      "manifest_canonical_path_ready": true,
      "name": "aoa-memo-writeback",
      "pending_technique_count": 0,
      "published_technique_count": 3,
      "scope": "core",
      "skill_path": "session-growth/aoa-memo-writeback/SKILL.md",
      "status": "scaffold",
      "tbd_ref_count": 0
    },
    {
      "lineage_blockers": [],
      "lineage_state": "published",
      "manifest_canonical_path_ready": true,
      "name": "aoa-port-adapter-refactor",
      "pending_technique_count": 0,
      "published_technique_count": 2,
      "scope": "core",
      "skill_path": "engineering/aoa-port-adapter-refactor/SKILL.md",
      "status": "evaluated",
      "tbd_ref_count": 0
    },
    {
      "lineage_blockers": [],
      "lineage_state": "published",
      "manifest_canonical_path_ready": true,
      "name": "aoa-property-invariants",
      "pending_technique_count": 0,
      "published_technique_count": 2,
      "scope": "core",
      "skill_path": "engineering/aoa-property-invariants/SKILL.md",
      "status": "canonical",
      "tbd_ref_count": 0